{
  "$schema": "https://json-schema.org/draft/2020-12/schema",
  "$id": "https://github.com/RNA4219/manual-bb-test-harness/schemas/execution_evidence.schema.json",
  "title": "ExecutionEvidence",
  "type": "object",
  "required": [
    "run_id",
    "feature_id",
    "build_id",
    "case_revision",
    "spec_revision",
    "oracle_revision",
    "case_content_hash",
    "oracle_refs",
    "timestamp",
    "result"
  ],
  "oneOf": [
    {
      "required": [
        "tc_id"
      ],
      "not": {
        "required": [
          "charter_id"
        ]
      }
    },
    {
      "required": [
        "charter_id"
      ],
      "not": {
        "required": [
          "tc_id"
        ]
      }
    }
  ],
  "properties": {
    "run_id": {
      "type": "string",
      "minLength": 1
    },
    "tc_id": {
      "type": "string",
      "minLength": 1
    },
    "charter_id": {
      "type": "string",
      "minLength": 1
    },
    "feature_id": {
      "type": "string",
      "minLength": 1
    },
    "build_id": {
      "type": "string",
      "minLength": 1
    },
    "case_revision": {
      "type": "string",
      "minLength": 1
    },
    "spec_revision": {
      "type": "string",
      "minLength": 1
    },
    "oracle_revision": {
      "type": "string",
      "minLength": 1
    },
    "case_content_hash": {
      "type": "string",
      "minLength": 1
    },
    "timestamp": {
      "type": "string",
      "format": "date-time"
    },
    "env": {
      "type": "string"
    },
    "device": {
      "type": "string"
    },
    "network_profile": {
      "type": "string"
    },
    "tester": {
      "type": "string"
    },
    "oracle_type": {
      "enum": [
        "specified",
        "derived",
        "implicit",
        "human"
      ]
    },
    "oracle_refs": {
      "type": "array",
      "minItems": 1,
      "items": {
        "type": "string"
      }
    },
    "expected": {
      "type": "array",
      "items": {
        "type": "string"
      }
    },
    "actual": {
      "type": "array",
      "items": {
        "type": "string"
      }
    },
    "result": {
      "enum": [
        "pass",
        "fail",
        "skip",
        "blocked",
        "unknown"
      ]
    },
    "attachments": {
      "type": "array",
      "items": {
        "type": "string"
      }
    },
    "anomaly_notes": {
      "type": "array",
      "items": {
        "type": "string"
      }
    },
    "defect_stub": {
      "type": "object",
      "required": [
        "title",
        "severity",
        "status"
      ],
      "properties": {
        "title": {
          "type": "string",
          "minLength": 1
        },
        "severity": {
          "enum": [
            "blocker",
            "critical",
            "high",
            "medium",
            "low"
          ]
        },
        "status": {
          "enum": [
            "open",
            "in_progress",
            "fixed",
            "pending_confirmation",
            "reopened",
            "resolved",
            "accepted"
          ]
        },
        "defect_id": {
          "type": "string",
          "minLength": 1
        }
      },
      "additionalProperties": false
    },
    "findings": {
      "type": "array",
      "items": {
        "type": "string"
      }
    },
    "time_spent_minutes": {
      "type": "number",
      "minimum": 0
    },
    "configuration_id": {
      "type": "string",
      "minLength": 1
    },
    "defects": {
      "type": "array",
      "items": {
        "type": "object",
        "required": [
          "title",
          "severity",
          "status"
        ],
        "properties": {
          "title": {
            "type": "string",
            "minLength": 1
          },
          "severity": {
            "enum": [
              "blocker",
              "critical",
              "high",
              "medium",
              "low"
            ]
          },
          "status": {
            "enum": [
              "open",
              "in_progress",
              "fixed",
              "pending_confirmation",
              "reopened",
              "resolved",
              "accepted"
            ]
          },
          "defect_id": {
            "type": "string",
            "minLength": 1
          }
        },
        "additionalProperties": false
      }
    },
    "coverage_obligation_ids": {
      "type": "array",
      "items": {
        "type": "string",
        "minLength": 1
      },
      "minItems": 0
    },
    "relation_evaluation": {
      "$ref": "shared_defs.schema.json#/$defs/RelationEvaluation"
    },
    "session_log": {
      "$ref": "shared_defs.schema.json#/$defs/SessionLog"
    },
    "model_ref": {
      "type": "string",
      "minLength": 1
    },
    "sample_id": {
      "type": "string",
      "minLength": 1
    },
    "observed_inputs": {
      "type": "object",
      "additionalProperties": {
        "type": [
          "string",
          "number",
          "boolean",
          "null"
        ]
      }
    },
    "schema_version": {
      "const": "1.1.0"
    },
    "migration": {
      "$ref": "shared_defs.schema.json#/$defs/Migration"
    },
    "observed_outputs": {
      "type": "object",
      "additionalProperties": {
        "type": [
          "string",
          "number",
          "boolean",
          "null"
        ]
      }
    },
    "model_hash": {
      "type": "string",
      "pattern": "^[a-f0-9]{64}$"
    }
  },
  "additionalProperties": false
}
