{
  "run_id": "RUN-2026-05-04-002",
  "tc_id": "TC-002",
  "feature_id": "ORD-CANCEL-01",
  "build_id": "web-1.42.0+1289",
  "timestamp": "2026-05-04T10:15:00+09:00",
  "env": "stg",
  "device": "iPhone 15 / iOS 18.4",
  "network_profile": "4g-lossy",
  "tester": "qa_a",
  "oracle_type": "specified",
  "oracle_refs": [
    "AC-1"
  ],
  "expected": [
    "注文状態がcancelledに変更"
  ],
  "actual": [
    "注文状態がcancelledに変更"
  ],
  "result": "pass",
  "attachments": [
    "s3://evidence/RUN-002/step3.png"
  ],
  "anomaly_notes": [],
  "case_revision": "case-rev-1",
  "spec_revision": "spec-rev-20260912",
  "oracle_revision": "oracle-rev-1",
  "case_content_hash": "sha256:ord-cancel-tc-002-rev-1"
}
