{
  "feature_id": "EVIDENCE-LIFECYCLE",
  "build_id": "build-1",
  "run_id": "RUN-FAIL",
  "tc_id": "TC-1",
  "timestamp": "2026-09-12T10:00:00Z",
  "result": "fail",
  "configuration_id": "android",
  "env": "Android",
  "defect_stub": {
    "defect_id": "BUG-1",
    "title": "保存データ消失",
    "severity": "high",
    "status": "open"
  },
  "case_revision": "case-rev-1",
  "spec_revision": "spec-rev-1",
  "oracle_revision": "oracle-rev-1",
  "case_content_hash": "sha256:evidence-lifecycle-tc-1",
  "oracle_refs": [
    "AC-1"
  ]
}
